1154,CPS_Early_Childhood_Portal_scrape.csv, Kozminski Com Acad,936 E. 54Th ,,5350980,,Prekindergarten For All,3-4 hours,,,,,,,,,,,,,,,,,,,,,,,
1992,DFSS_AgencySiteLies_2012.csv,"Chicago Public Schools Doolittle, James R.",535 East 35th Street ,60653,5351040,,,,,,,Chicago Public Schools,,,,,,,,,,,www.cps.edu,Paula Cottone,Ms. Lauren Norwood,,,,,,
3221,purple_binder_early_childhood.csv, Marcy Newberry Association - Austin Town Hall,5610 W Lake Street ,60644,2611505,,,,,,,,,,,,,,,,,,,,,,,,,,Child Care
410,CPS_Early_Childhood_Portal_scrape.csv, Kiddy Kare Preschools Little Learners,5923 W. 63rd St. ,,5815541,,Community Partnerships,"8-11 Hours, varies by facility",,,,,,,,,,,,,,,,,,,,,,,
484,CPS_Early_Childhood_Portal_scrape.csv, ChildServ - Pilsen,1711 W Garfield Blvd ,,,,Early Head Start,EXTENDED DAY,,,,,,,,,,,,,,,,,,,,,,,
2941,NAEYC_accreditation.csv, Loop Learning Center,2001 South Michigan Avenue  ,60616,2258828,,,,,,,,,,,,,,,,,,,,,,02/01/17,722736,,,
2045,DFSS_AgencySiteLies_2012.csv,"Chicago Public Schools Morgan, Garrett A.",8407 S. Kerfoot ,60620,5353366,,,,,,,Chicago Public Schools,,,,,,,,,,,www.cps.edu,Paula Cottone,Jerrold Washington,,,,,,
2134,DFSS_AgencySiteLies_2012.csv,Easter Seals Society of Metropolitan Chicago Lordanchild Daycare,3344 W 79th St ,60652,4344918,,,,,,,Easter Seals Society of Metropolitan Chicago,,,,,,,,,,,www.easterseaslchicago.org,Barbara Zawacki,Quentin Donald ,,,,,,
473,CPS_Early_Childhood_Portal_scrape.csv, Woodlawn Early Childhood Development,950 E. 61st Street ,,6673300,,Community Partnerships,"8-11 Hours, varies by facility",,,,,,,,,,,,,,,,,,,,,,,
3164,purple_binder_early_childhood.csv, Heartland Alliance for Human Needs and Human Rights - Learning Center,615 W Wellington Avenue ,60657,7511870,,,,,,,,,,,,,,,,,,,,,,,,,,Child Care
1874,chapin_dfss_providers_2011_070212.csv,SALVATION ARMY INCARNATION,1345 N KARLOV ,60651,2764118,,,,,,,SALVATION ARMY,HUMBOLDT PARK,,,,,Zoraida Fernandini,Yes,No,No,,,,,,,,,,
2607,ECE Chicago Find a School scrape.csv, Kozminski Com Acad,936 E. 54th St. ,60615,5350980,,,,,,Hyde Park,,,,,,,,,,,,,PFA-REG,,,,,,,
3184,purple_binder_early_childhood.csv, JCYS Lakeview Family Center,957 W Grace Street ,60613,2812533,,,,,,,,,,,,,,,,,,,,,,,,,,Child Care
2136,DFSS_AgencySiteLies_2012.csv,Easter Seals Society of Metropolitan Chicago Near South Side Child Development Center,2214 S Federal St ,60616,5483614,,,,,,,Easter Seals Society of Metropolitan Chicago,,,,,,,,,,,www.easterseaslchicago.org,Barbara Zawacki,Catherine Rokusek ,,,,,,
2785,ECE Chicago Find a School scrape.csv, Spry,2400 S. Marshall Bl ,60623,5341700,,,,,,South Lawndale,,,,,,,,,,,,,PFA-REG,,,,,,,
258,CPS_Early_Childhood_Portal_scrape.csv, Erie Neighborhood House,1701 W. Superior ,,5635800,,Community Partnerships,"8-11 Hours, varies by facility",,,,,,,,,,,,,,,,,,,,,,,
1100,CPS_Early_Childhood_Portal_scrape.csv, Lovett,6333 W. Bloomingdale ,,5343130,,Prekindergarten For All,3-4 hours,,,,,,,,,,,,,,,,,,,,,,,
409,CPS_Early_Childhood_Portal_scrape.csv, Lake Shore Schools - Clark,5611 N. Clark Street ,,5616707,,Community Partnerships,"8-11 Hours, varies by facility",,,,,,,,,,,,,,,,,,,,,,,
1357,IDHS_child_care_provider_list.csv," Paxton Day Care
Center",200 North Elm Street Paxton,60957,3793865,"(217)
379-6205",,,7766-4691-7433-009,,,,,,,,,,,,,,,,,,,,,,
2077,DFSS_AgencySiteLies_2012.csv,"Chicago Public Schools Stockton, Joseph",4423 N. Magnolia ,60640,5342510,,,,,,,Chicago Public Schools,,,,,,,,,,,www.cps.edu,Paula Cottone,Ms. Jill Besenjak,,,,,,
1793,chapin_dfss_providers_2011_070212.csv,HULL HOUSE ASSOCIATION KINGS KIDDIE KINGDOM,815 W 74TH ST ,60621,,,,,,,,HULL HOUSE ASSOCIATION,ENGLEWOOD,,,,,Camille King,Yes,No,No,,,,,,,,,,
657,CPS_Early_Childhood_Portal_scrape.csv, Gads Hill Center - Sinai Community/Ogden,2653 W Ogden Ave ,,5211196,,Head Start,HALF DAY/FULL DAY,,,,,,,,,,,,,,,,,,,,,,,
467,CPS_Early_Childhood_Portal_scrape.csv, Little Elite Academy,8748 S. Aberdeen ,,4487990,,Community Partnerships,"8-11 Hours, varies by facility",,,,,,,,,,,,,,,,,,,,,,,
2582,ECE Chicago Find a School scrape.csv, Irving Park Early Learning Ctr,3023 W. Montrose ,60618,5397422,,,,,,Irving Park,,,,,,,,,,,,,CP,,,,,,,
364,CPS_Early_Childhood_Portal_scrape.csv, Ada S. McKinley Maggie Drummond,4301 S. Wabash ,,3738200,,Community Partnerships,"8-11 Hours, varies by facility",,,,,,,,,,,,,,,,,,,,,,,
1558,chapin_dfss_providers_2011_070212.csv,"CHICAGO PUBLIC SCHOOLS O'KEEFFE, ISABELL C.",6940 S MERRILL ,60649,5350600,,,,,,,CHICAGO PUBLIC SCHOOLS,SOUTH SHORE,,,,,Mrs. Carolyn D.  Townes,Yes,No,No,,,,,,,,,,
1472,chapin_dfss_providers_2011_070212.csv,"CHICAGO PUBLIC SCHOOLS BEETHOVEN, LUDWIG V.",25 W 47TH ST ,60609,5351480,,,,,,,CHICAGO PUBLIC SCHOOLS,GRAND BOULEVARD,,,,,Ms. Dyrice Garner,Yes,No,No,,,,,,,,,,
1859,chapin_dfss_providers_2011_070212.csv,ONWARD NEIGHBORHOOD HOUSE NEW BEGINNINGS,5445 W NORTH AVENUE ,60639,3855365,,,,,,,ONWARD NEIGHBORHOOD HOUSE,AUSTIN,,,,,Verlene Vanderbilt,Yes,No,No,,,,,,,,,,
2367,ECE Chicago Find a School scrape.csv, Carter,5740 S. Michgan Ave. ,60637,5350860,,,,,,Washington Park,,,,,,,,,,,,,PFA-REG,,,,,,,
96,CPS_Early_Childhood_Portal_scrape.csv, YMCA of Metropolitan Chicago - South Chicago YMCA,3039 E 91st St ,,7219100,,Child Care,EXTENDED DAY,,,,,,,,,,,,,,,,,,,,,,,
1653,chapin_dfss_providers_2011_070212.csv,EL HOGAR DEL NINO FCCH-MARIA GUZMAN,5548 S TRIPP AVE ,60629,7354542,,,,,,,EL HOGAR DEL NINO,WEST ELSDON,,,,,,Yes,Yes,No,"5873PS(HS Collaboration with Childcare Homes), 5657IP(EHS Co",,,,,,,,,
546,CPS_Early_Childhood_Portal_scrape.csv," Brown Academy, R.",12607 S. Union ,,5355385,,Head Start,3-4 hours,,,,,,,,,,,,,,,,,,,,,,,
1166,CPS_Early_Childhood_Portal_scrape.csv, Marcy Newberry Association - FOSCO ABLA Center,1312 S Racine Ave ,,7466024,,School Age,PART DAY/FULL DAY,,,,,,,,,,,,,,,,,,,,,,,
522,CPS_Early_Childhood_Portal_scrape.csv, Kohn,10414 S. State St. ,,5355489,,Head Start,3-4 hours,,,,,,,,,,,,,,,,,,,,,,,
3325,purple_binder_early_childhood.csv, North Avenue Day Nursery,2001 W Pierce Street ,60622,3424499,,,,,,,,,,,,,,,,,,,,,,,,,,Early Head Start
2253,DFSS_AgencySiteLies_2012.csv,Onward Neighborhood House New Beginnings,5445 W. North Ave. ,60639,3855365,,,,,,,Onward Neighborhood House,,,,,,,,,,,www.onwardhouse.org,Mario Garcia,Verlene Vanderbilt,,,,,,
2233,DFSS_AgencySiteLies_2012.csv,Marcy Newberry Association Learning Tree 2,8322 S Pulaski Rd. ,60652,8843345,,,,,,,Marcy Newberry Association,,,,,,,,,,,www.marcy-newberry.org,Gertrude Ricks,Joanne Williams ,,,,,,
2885,NAEYC_accreditation.csv, Chesterfield Tom Thumb Day Care Center & Kindergarten,9208-9214 South Cottage Grove  ,60619,8743985,,,,,,,,,,,,,,,,,,,,,,09/30/13,564164,brittsavage@sbcglobal.net,,
3092,purple_binder_early_childhood.csv, Chicago Commons - Taylor Center School,1633 N Hamlin Avenue ,60647,2278551,,,,,,,,,,,,,,,,,,,,,,,,,,Child Care
2925,NAEYC_accreditation.csv, Howard Area Family Center,7510 N. Ashland Avenue  ,60626,7647610,,,,,,,,,,,,,,,,,,http://www.howardarea.org,,,,09/30/14,372557,skoliarakis@howardarea.org,,
1717,chapin_dfss_providers_2011_070212.csv,GADS HILL CENTER FCCH-SARA ORTEGA SITE,6110 S MOZART ,60629,2511196,,,,,,,GADS HILL CENTER,CHICAGO LAWN,,,,,Celina Orozco,No,No,No,"5707IP(EHS Collaboration Enhanced Home IP), 5713IT(Child Car",,,,,,,,,
1847,chapin_dfss_providers_2011_070212.csv,NORTH AVENUE DAY NURSERY FCCH-ROBBIE ANTHONY,5916 WEST SUPERIOR ,60644,2974124,,,,,,,NORTH AVENUE DAY NURSERY,AUSTIN,,,,,Sonja Anthony,No,Yes,No,"6124IP(EHS Collaboration Enhanced Home IP), 6125IT(Child Car",,,,,,,,,
456,CPS_Early_Childhood_Portal_scrape.csv," Terry Town Nursery School, Inc.",817 N. Hamlin ,,4894271,,Community Partnerships,"8-11 Hours, varies by facility",,,,,,,,,,,,,,,,,,,,,,,
2007,DFSS_AgencySiteLies_2012.csv,"Chicago Public Schools Goudy, William C.",5120 N. Winthrop ,60640,5342480,,,,,,,Chicago Public Schools,,,,,,,,,,,www.cps.edu,Paula Cottone,Pamela S. Brandt,,,,,,
1000,CPS_Early_Childhood_Portal_scrape.csv, Barry,2828 N. Kilbourn ,,5343455,,Prekindergarten For All,3-4 hours,,,,,,,,,,,,,,,,,,,,,,,
250,CPS_Early_Childhood_Portal_scrape.csv, Lutheran Social Services North Austin,1500 N. Mason ,,2371930,,Community Partnerships,"8-11 Hours, varies by facility",,,,,,,,,,,,,,,,,,,,,,,
2420,ECE Chicago Find a School scrape.csv, Christopher House Lakeshore,850 W. Eastwood ,60640,2719403,,,,,,Uptown,,,,,,,,,,,,,CP,,,,,,,
156,CPS_Early_Childhood_Portal_scrape.csv, Onward Neighborhood House - Onward Neighborhood House,600 N Leavitt St ,,6666726,,Child Care,EXTENDED DAY,,,,,,,,,,,,,,,,,,,,,,,
1364,IDHS_child_care_provider_list.csv," Tri-Con Child Care Center, Inc.","425 Laurel Avenue
Highland Park",60035,4331450,"(847)
433-1749",,,9795-2875-5433-009,,,,,,,,,,,,,,,,,,,,,,
3086,purple_binder_early_childhood.csv, Centers for New Horizons Washington Park,6225 S Wabash Avenue ,60637,6672065,,,,,,,,,,,,,,,,,,,,,,,,,,Child Care
690,CPS_Early_Childhood_Portal_scrape.csv, Bethel New Life - Lake and Pulaski,316 N Pulaski Rd ,,2653830,,Head Start,HALF DAY/FULL DAY,,,,,,,,,,,,,,,,,,,,,,,
416,CPS_Early_Childhood_Portal_scrape.csv, Boys & Girls Clubs John L. Yancey,6245 S. Wabash ,,3634733,,Community Partnerships,"8-11 Hours, varies by facility",,,,,,,,,,,,,,,,,,,,,,,
